name,reading,biography,period
志村けん,しむらけん,日本のコメディアン・タレント(1950-2020)。本名は志村康徳。ザ・ドリフターズのメンバーとして活動し、その後『志村けんのバカ殿様』『だっふんだ』『アイーン』などのギャグで国民的人気を博した。身体を使ったコメディと絶妙なタイミングの間で、子どもから大人まで幅広い層に愛された。師匠である荒井注やコント55号から受け継いだコメディの伝統を発展させ、日本のお笑い界に革命をもたらした。「笑いは世界共通語」「お客さんが笑ってくれれば、それが一番幸せ」という信念で生涯にわたって人々に笑いを提供し続け、日本のコメディ界の巨星として永遠に語り継がれている。,
ビートたけし,びーとたけし,日本のコメディアン・映画監督・タレント(1947-)。本名は北野武。ツービートとして漫才ブームを牽引し、その後映画監督として国際的な評価を獲得。『その男、凶暴につき』『HANA-BI』などの作品でカンヌ国際映画祭で受賞するなど、エンターテインメント界の巨匠として活躍。毒舌と鋭い社会風刺で知られ、「バラエティ番組は視聴者をバカにしているが、バカにされる方も悪い」など、メディアや社会に対する辛辣な批判を展開。その破天荒で自由な発言は多くの人々に影響を与え、日本のお笑い界と映画界の両方で不動の地位を築いている。,
萩本欽一,はぎもときんいち,日本のコメディアン・タレント・司会者(1941-)。愛称は「欽ちゃん」。コント55号として坂上二郎と共に活動し、その後『欽ちゃんのドンとやってみよう!』などのバラエティ番組で司会者として活躍。独特の間とアドリブで視聴者を魅了し、「欽ちゃん走り」「なんてったってアイドル」などの流行語を生み出した。「人を笑わせるのは人を泣かせるより難しい」「テレビは家族で見るものだから、みんなが笑えるものを作りたい」という信念で、健全で温かいお笑いを追求し続けた。その人柄と芸風は多くの後進芸人に影響を与え、日本のお笑い界の父的存在として尊敬されている。,
立川談志,たてかわだんし,日本の落語家・政治家(1936-2011)。本名は松岡克由。立川流家元として革新的な落語を追求し、「現代の名人」と称された。従来の落語の型にとらわれない自由な芸風で話題を呼び、「落語とは人間の業の肯定である」という独自の落語論を展開した。政治家として参議院議員も務め、歯に衣着せぬ発言で注目を集めた。「落語家は芸人じゃない、落語という芸を背負った人間だ」「笑いは文化である」など、芸道に対する深い思いを込めた言葉を残している。その破天荒で革新的な姿勢は多くの落語家に影響を与え、現代落語界の発展に大きく貢献した。,元
ダライ・ラマ14世,だらい・らま14せい,1935年生まれのチベット仏教の最高指導者。中国のチベット侵攻後、インドに亡命し、チベット亡命政府を率いている。1989年にノーベル平和賞を受賞。「慈悲」と「非暴力」の教えを説き、世界平和のために活動している。「私の宗教は親切です」という言葉で知られ、宗教の枠を超えた普遍的な価値を説いている。科学との対話を重視し、仏教と現代科学の融合を図っている。世界各国で講演を行い、多くの人々に仏教の智慧を伝えている。その温かい人柄と深い智慧は宗教の違いを超えて多くの人々に愛されている。,現代
ティク・ナット・ハン,てぃく・なっと・はん,1926年生まれのベトナム出身の禅僧。ベトナム戦争中に平和活動を行い、「エンゲイジド・ブッディズム」(社会参加仏教)を提唱した。マインドフルネスの実践を世界に広め、日常生活の中での瞑想を説いた。「今この瞬間に生きる」ことの大切さを説き、現代人のストレス解消に大きな影響を与えた。「歩く瞑想」「食べる瞑想」など、日常の行為すべてを修行とする教えで知られる。平和活動家としても活動し、非暴力による社会変革を訴えた。その教えは現在、世界中のマインドフルネス実践者に大きな影響を与えている。,現代
ヴィクトール・フランクル,?ぃくとーるふらんくる,オーストリアの心理学者。第二次世界大戦中にナチスの強制収容所に収容され、極限状況での人間の精神力について研究した。「人間は自分に起こることを選択できないが、それにどう対処するかは選択できる」「困難の中にこそ、人生の意味がある」など、逆境と希望に関する深い名言を残している。『夜と霧』で収容所体験を記録し、ロゴセラピーという心理療法を開発した。最も過酷な状況でも希望を失わず、人間の尊厳を守り続けた。彼の言葉は、どんな困難も乗り越えられる人間の精神力の強さを教える永遠の教訓となっている。,
エックハルト・トール,えっくはると・とーる,現代のドイツ出身の精神的教師。29歳の時に深い精神的覚醒を体験し、現在の瞬間に完全に存在することの重要性を説いている。「パワー・オブ・ナウ」「ニュー・アース」などの著書で知られる。「今」に注意を向けることで苦しみから解放されると説いた。エゴの働きを客観視し、思考に同一化しないことの大切さを教えている。「あなたは自分の思考ではない」という洞察で多くの人々を導いている。仏教やヒンドゥー教の智慧を現代的な言葉で表現し、宗教の枠を超えた普遍的な教えとして多くの人々に受け入れられている。,現代
エルネスト・シャクルトン,えるねすとしゃくるとん,イギリスの南極探検家。1914年から1917年にかけて行われた南極横断遠征で、氷に閉ざされた船エンデュアランス号から乗組員全員を救出した奇跡的なリーダーシップで知られる。「楽観主義者は困難の中にチャンスを見出し、悲観主義者はチャンスの中に困難を見出す」「不可能を可能にするのは、決して諦めない心だ」など、極限状況での勇気とリーダーシップに関する名言を残している。22か月間の氷上での苦闘を通じて、部下への配慮と不屈の精神を示した。彼の言葉は、困難な状況でのリーダーシップと、決して諦めない精神の重要性を教えてくれる。,20世紀
チャールズ・リンドバーグ,ちゃーるずりんどばーぐ,アメリカの飛行家。1927年に単独無着陸でニューヨーク・パリ間の大西洋横断飛行を成功させ、世界的な英雄となった。「成功は準備と機会が出会った時に生まれる」「困難は、それを乗り越えた時に価値を持つ」など、挑戦と勇気に関する名言を残している。当時は非常に危険とされた長距離飛行に挑戦し、33時間30分の孤独な飛行を成功させた。この快挙は航空技術の発展を大きく促進した。彼の言葉は、新しい領域への挑戦と、困難を乗り越える勇気の重要性を教える永遠の教訓となっている。,20世紀
エドマンド・ヒラリー,えどまんどひらりー,ニュージーランドの登山家。1953年にシェルパのテンジン・ノルゲイと共に、世界で初めてエベレスト登頂に成功した。「頂上に立つことが重要なのではない。そこに至る過程が重要なのだ」「山は私たちが思っている以上に多くのことを教えてくれる」など、挑戦と自然への敬意に関する名言を残している。養蜂家として働きながら登山を続け、数々の困難を乗り越えて人類の夢を実現した。登頂後もネパールの教育や医療支援に尽力し、生涯にわたって社会貢献を続けた。彼の言葉は、目標達成への情熱と、他者への奉仕の重要性を教えてくれる。,20世紀
レイチェル・カーソン,れいちぇる・かーそん,アメリカの海洋生物学者、作家。1962年に発表した『沈黙の春』で農薬の危険性を告発し、現代の環境保護運動の先駆けとなった。DDTなどの化学物質が生態系に与える深刻な影響を科学的に証明し、環境問題への社会的関心を高めた。彼女の著作は環境保護法の制定にも大きな影響を与え、EPA(環境保護庁)設立のきっかけとなった。海への深い愛情と科学的洞察力で、人類と自然の調和を訴え続けた環境保護のパイオニア。,明
ジェーン・グドール,じぇーん・ぐどーる,イギリスの動物行動学者。タンザニアのゴンベ国立公園でチンパンジーの野外研究を60年以上続け、類人猿研究の第一人者となった。チンパンジーが道具を使用することを発見し、人間と動物の境界に関する従来の概念を覆した。個体に名前を付けて長期観察する手法により、チンパンジーの複雑な社会構造と感情を明らかにした。研究者から環境保護活動家へと転身し、ジェーン・グドール・インスティテュートを設立して世界的な保護活動を展開している。「希望がある限り、私たちは行動し続けなければならない」として、若い世代への環境教育にも力を入れている。,明
グレタ・トゥーンベリ,ぐれた・とぅーんべり,スウェーデンの環境活動家。15歳で始めた学校ストライキが世界的な気候変動抗議運動に発展し、若い世代の環境意識を覚醒させた。国連気候行動サミットでの演説「How dare you(よくもそんなことを)」で大人世代の無責任さを糾弾し、世界に衝撃を与えた。アスペルガー症候群を「スーパーパワー」と表現し、集中力と正義感で環境問題に取り組んでいる。金曜日の未来のためのストライキ(Fridays for Future)を世界的ムーブメントに発展させた。「私たちは絶滅の始まりにいるのに、お金と永続的な経済成長のおとぎ話しかできない」として、根本的な社会変革を求めている。,
アル・ゴア,ある・ごあ,アメリカの政治家、環境活動家。アメリカ副大統領を務めた後、気候変動問題の啓発活動に専念した。ドキュメンタリー映画『不都合な真実』で地球温暖化の現実を広く伝え、アカデミー賞とノーベル平和賞を受賞した。気候変動に関する政府間パネル(IPCC)と共にノーベル平和賞を受賞し、気候変動対策の国際的推進に貢献した。政治家としての経験を活かし、環境問題を政策課題として定着させることに成功した。「私たちは地球からの借り物で生きている。次世代に美しい地球を残すのは私たちの責任だ」として、持続可能な社会の実現を訴えている。,
南方熊楠,みなかた・くまぐす,日本の博物学者、民俗学者。明治時代に世界各地を遊学し、菌類研究で国際的な評価を得た。和歌山県の神社合祀反対運動を展開し、日本初の自然保護運動を主導した。粘菌の研究で知られ、生命現象の複雑さと美しさを追求した。民俗学と自然科学を融合させ、「事不思議」の概念で世界の神秘を表現した。萃点(すいてん)の思想で、すべての現象の相互関連性を説いた。「自然と人間の文化は切り離せない」として、文化的景観の保護の先駆けとなった。エコロジーと文化の統合を図った日本独自の自然思想家として、現在でも高く評価されている。,明
今西錦司,いまにし・きんじ,日本の生態学者、人類学者。世界で初めてニホンザルの群れの社会構造を解明し、霊長類学の基礎を築いた。「棲み分け理論」を提唱し、種の共存メカニズムを説明した。ダーウィンの自然選択説とは異なる独自の進化論を展開し、「種社会」の概念を提示した。京都大学山岳部を組織し、多くの探検家と研究者を育てた。生態系における種間関係の重要性を重視し、競争よりも協調を強調する生態学的思考を発展させた。「自然は征服するものではなく、共生するものである」として、東洋的な自然観に基づく生態学を構築した。,明
中村桂子,なかむら・けいこ,日本の生命科学者、科学ジャーナリスト。「生命誌」という新しい学問分野を提唱し、分析的な生物学から総合的な生命理解への転換を図った。DNAから読み解く生命の歴史と多様性を一般にもわかりやすく伝え、科学と文化の橋渡しを行った。JT生命誌研究館を設立し、研究と教育を統合した新しい科学館のモデルを作った。「生きている」ことの意味を科学と人文学の両面から探求し、生命尊重の文化の創造を目指している。女性科学者の先駆けとして、男性中心的な科学界で活躍し、後進の育成にも努めた。自然と人間の関係を生命の歴史から捉え直す視点を提供している。,
辻信一,つじ・しんいち,日本の環境運動家、文化人類学者。スローライフ運動の日本での先駆者として、消費社会への批判と持続可能な生活様式の提案を行っている。メキシコでの文化人類学的研究から、先住民の時間感覚と自然観を学び、近代的効率主義への疑問を深めた。ナマケモノ倶楽部を設立し、「しないこと」の価値とゆっくり生きることの重要性を提唱している。フェアトレードや地域通貨の普及を通じて、オルタナティブな経済システムの実現を目指している。「早く、より多く、より遠くへ」という近代の価値観に対して、「ゆっくり、小さく、美しく」という新しい価値観を提示している。,近代
黒澤明,くろさわあきら,日本の映画監督(1910-1998)。『七人の侍』『用心棒』『羅生門』などの代表作で世界的な評価を獲得し、「世界のクロサワ」と呼ばれた。完璧主義者として知られ、撮影現場では厳格な一面を見せたが、一方で茶目っ気のある人物でもあった。「映画は娯楽でなければならない。説教臭いものは映画ではない」「雨の日には雨の、晴れの日には晴れの表情がある」など、映画制作に対する深い哲学を語った。また「私は映画を作ることしかできない無能な人間だ」といった自虐的なユーモアも持ち合わせていた。その情熱と人間性は世界中の映画人に影響を与え続けている。,
山田洋次,やまだようじ,日本の映画監督(1931-)。『男はつらいよ』シリーズで国民的人気を博し、日本映画界の巨匠として活動を続けている。庶民の視点から描いた人情喜劇で多くの観客に愛された。「映画は人間を描くもの。技術や理論よりも、人間への愛情が大切」「寅さんは私の理想の人間像。自分も寅さんのように生きたい」など、人間愛に満ちた発言をしている。また「日本人は謙虚すぎる。もっと自信を持っていい」といった社会に対する温かい眼差しも示している。その優しさと洞察力に満ちた作品群は、日本映画の宝として多くの人々に愛され続けている。現在90歳を超えてなお現役で活動を続ける姿勢も尊敬を集めている。,
伊丹十三,いたみじゅうぞう,日本の映画監督・俳優・エッセイスト(1933-1997)。本名は池内義弘。『お葬式』『タンポポ』『マルサの女』などのユニークな着眼点の映画で日本映画界に新風を吹き込んだ。エッセイストとしても活動し、日常生活の些細な出来事を鋭い観察眼とユーモアで描いた。「日本人は形式を重んじるが、その本質を見失うことがある」「映画は観客との会話だ。一方的に話すのではなく、相手の反応を感じながら作る」など、社会や映画に対する独自の見解を示した。その知的で皮肉なユーモアと社会への鋭い洞察は現代でも多くの創作者に影響を与えている。,現代
ジョージ・ルーカス,じょーじるーかす,映画監督。『スター・ウォーズ』『インディ・ジョーンズ』シリーズを手がけ、現代映画の父と呼ばれる。「夢は実現させるためにある」「失敗は成功への第一歩だ」など、創造性と挑戦に関する名言を残している。革新的な映像技術と壮大な物語で、映画界の新しい時代を切り開いた。ILM(Industrial Light & Magic)を設立し、特殊効果技術の発展に大きく貢献した。彼の言葉は、創造性への挑戦と、新しい技術を追求することの重要性を教えてくれる。,現代
スティーブン・スピルバーグ,すてぃーぶんすぴるばーぐ,アメリカの映画監督。『ジョーズ』『E.T.』『ジュラシック・パーク』など数々の名作を手がけ、現代映画界の巨匠として知られる。「失敗は成功への最短距離だ」「夢は諦めなければ必ず叶う」など、創造性と挑戦に関する名言を残している。若い頃から映画への情熱を持ち続け、独学で映画制作を学んだ。アカデミー賞を何度も受賞し、映画技術の発展にも大きく貢献した。彼の言葉は、情熱を持って取り組むことの大切さと、決して諦めない精神の重要性を教えてくれる。,現代
ジェームズ・キャメロン,じぇーむずきゃめろん,映画監督。『タイタニック』『アバター』などの大作映画を手がけ、革新的な映像技術で映画界に革命をもたらした。「限界は想像力だけだ」「不可能を可能にするのは、諦めない心だ」など、創造性と挑戦に関する名言を残している。深海探査にも情熱を注ぎ、2012年には単独で世界最深部のマリアナ海溝に到達した。映画制作でも常に新しい技術に挑戦し、CGIやモーションキャプチャーの発展に大きく貢献した。彼の言葉は、創造性への挑戦と、技術革新の重要性を教える現代の教訓となっている。,現代
ボブ・ディラン,ぼぶでぃらん,アメリカのシンガーソングライター。フォークソング、ロックの世界に革命をもたらし、ノーベル文学賞も受賞した。「昨日の自分にとらわれるな」「時代は変わる」など、変化と挑戦に関する名言を残している。1960年代から現在まで、常に音楽的な冒険を続けている。社会的なメッセージを込めた楽曲で、多くの人々に影響を与えた。彼の言葉は、変化を恐れない勇気と、時代の流れに敏感であることの重要性を教えてくれる。,20世紀
ジミ・ヘンドリックス,じみへんどりっくす,アメリカのロックギタリスト。革新的なギター奏法で音楽界に革命をもたらし、「ギターの神様」と呼ばれる。「音楽は私の宗教だ」「限界は自分で決めるものだ」など、音楽への情熱と創造性に関する名言を残している。わずか4年間の活動期間で、ロック史に永遠に残る影響を与えた。左利きでありながら右利き用ギターを逆さまに弾く独特のスタイルで、多くのギタリストに影響を与えた。彼の言葉は、創造性への挑戦と、既存の枠にとらわれない自由な発想の重要性を教えてくれる。,
エルヴィス・プレスリー,える?ぃすぷれすりー,アメリカの歌手。「キング・オブ・ロックンロール」として知られ、音楽界に革命をもたらした。「夢は叶えるためにある」「人生は短い、楽しまなければ」など、夢と人生の楽しさに関する名言を残している。貧しい家庭で育ちながらも、音楽への情熱で世界的なスターになった。人種の壁を超えて多くの人々に愛され、音楽の可能性を広げた。彼の言葉は、夢を追い続ける勇気と、人生を楽しむことの大切さを教えてくれる。,
チャーリー・チャップリン,ちゃーりーちゃっぷりん,イギリス出身の俳優・映画監督・脚本家・作曲家(1889-1977)。サイレント映画時代から活躍し、「小さな放浪者」として親しまれた。身体を使ったコメディと社会風刺を組み合わせた独特の芸風で世界中の人々を魅了した。『モダン・タイムス』『独裁者』では機械文明や全体主義を鋭く批判。「人生をクローズアップで見れば悲劇だが、ロングショットで見れば喜劇だ」という名言に象徴されるように、人間の尊厳と愛を根底に据えた作品を作り続けた。彼のヒューマニズムあふれるユーモアは映画界の宝として永遠に語り継がれている。,明
グルーチョ・マルクス,ぐるーちょまるくす,アメリカのコメディアン・俳優(1890-1977)。マルクス兄弟の一員として活動し、独特の口ひげと眉毛、葉巻をくわえた姿で知られる。シニカルで機智に富んだ一言で観客を笑わせた。「私はこんなクラブには入りたくない。なぜなら私のような人間を会員にするクラブだからだ」という自虐的なジョークは特に有名。映画『ココナッツ』『馬鹿騒ぎ』などでナンセンスコメディの金字塔を築いた。その言葉遊びと社会への皮肉は、後のコメディアンたちに大きな影響を与え、現代のスタンダップコメディの原型を作り上げた功績は計り知れない。,現代
ウッディ・アレン,うっでぃあれん,アメリカの映画監督・脚本家・俳優・コメディアン(1935-)。本名はアラン・スチュワート・ケーニッグスバーグ。神経質で自虐的なユーモアで知られ、恋愛や人生の不条理を描いた作品で数々の賞を受賞。『アニー・ホール』『マンハッタン』などの代表作では、インテリジェントで皮肉な会話が印象的。「人生は悲劇か喜劇かに分かれる。喜劇は悲劇に笑いが加わったものだ」など、哲学的でありながら親しみやすい言葉で人生の本質を表現する。彼の内省的で知的なユーモアは、現代映画界において独特の地位を築いている。,現代
ロビン・ウィリアムズ,ろびんうぃりあむず,アメリカの俳優・コメディアン(1951-2014)。即興コメディの天才として知られ、『グッド・ウィル・ハンティング』でアカデミー助演男優賞を受賞。『いまを生きる』『パッチ・アダムス』『グッドモーニング・ベトナム』などで演技力も高く評価された。スタンダップコメディでは超高速の早口とエネルギッシュなパフォーマンスで観客を魅了した。「君は完璧である必要はない。ただ君である必要がある」「最も悲しい人々が、他人を幸せにしようと最も努力する」など、人生への深い洞察を込めた言葉を残している。その温かく人間味溢れるユーモアは世界中の人々に愛され続けている。,
田中角栄,たなかかくえい,日本の政治家(1918-1993)。第64・65代内閣総理大臣を務め、「日本列島改造論」を提唱した。高等小学校卒業という学歴ながら、持ち前の才覚と人情味で政界のトップに上り詰めた。「政治は数だ」「人の心を動かすのは論理ではなく、情だ」など、政治の本質を突いた名言を残した。また「私は勉強が嫌いだったから、勉強しなくても済む方法ばかり考えていた」「貧乏人は麦を食え、と言われた時代もあったが、今は米を食えと言いたい」など、庶民感覚を忘れない人間味溢れる発言で親しまれた。その人柄と実行力は現代でも多くの政治家の手本とされている。,現代
