name,reading,biography,period
孔子,こうし,紀元前551年~479年。中国春秋時代の思想家、政治家、教育者。儒教の開祖として知られ、『論語』にその教えが記録されている。政治的理想と人間関係の調和を重視し、「仁」「礼」「義」を核とした統治論を展開。魯国で政治に関わり、その思想は後の中国政治思想の基盤となった。戦略的思考においては、武力よりも徳による統治を説き、人心掌握と組織運営の原理を示した。弟子三千人、賢人七十二人を育て、教育者としても卓越した指導力を発揮。その思想は東アジア全域に影響を与え、現代でもリーダーシップ論や組織論の古典として参照される。,春秋時代
孫子,そんし,紀元前535年頃~496年頃。中国春秋時代の軍事思想家。本名は孫武。『孫子の兵法』の著者として世界的に知られる。呉国の将軍として活躍し、楚国との戦いで連戦連勝を収めた。「兵は国の大事なり」「彼を知り己を知れば百戦殆うからず」「戦わずして人の兵を屈するは善の善なる者なり」など、現代でも通用する戦略原則を確立。情報収集、心理戦、地の利の活用、兵站の重要性を説き、武力行使は最後の手段とする思想を展開。その兵法は軍事戦略にとどまらず、ビジネス戦略、競争戦略の古典として世界中で研究され続けている。,春秋時代
老子,ろうし,古代中国の思想家。道教の始祖とされる。「道徳経」の著者として知られ、「道」を万物の根源とする思想を説いた。「無為自然」の教えで、人為的な努力を避け、自然の流れに従うことを説いた。「上善は水の如し」として、水のように柔軟で謙虚な生き方を理想とした。「大器晩成」「柔よく剛を制す」などの言葉でも知られる。政治においても「無為の治」を説き、最小限の統治が最良であると主張した。その思想は後の中国思想に大きな影響を与え、現在でも多くの人々に愛され続けている。東洋哲学の源流の一つとして世界的に研究されている。,古代
荘子,そうじ,戦国時代の中国の思想家。老子の思想を発展させ、道家思想を深化させた。「荘子」という書物で知られ、寓話を用いて深い哲学を説いた。「胡蝶の夢」の話で現実と夢の境界を問い、万物の相対性を説いた。「無用の用」の思想で、一見無駄に見えるものの価値を示した。「至人無己、神人無功、聖人無名」として理想的な人間像を描いた。自由で自然な生き方を説き、社会の束縛から解放された境地を理想とした。その思想は文学性に富み、中国文化に大きな影響を与えた。現在でも多くの人々に愛読されている。,戦国時代
孟子,もうし,戦国時代の中国の思想家。孔子の思想を発展させ、儒教の理論的基盤を築いた。「性善説」を説き、人間の本性は善であると主張した。「仁政」の重要性を説き、王道政治を理想とした。「民を貴しとなし、社稷これに次ぎ、君を軽しとなす」として民本思想を示した。「浩然の気」の概念で、正義に基づく精神力の重要性を説いた。教育の必要性を強調し、「教えざるは父の過なり」として家庭教育の重要性を説いた。その思想は後の中国政治思想に大きな影響を与え、現在でも東アジアの政治哲学の基盤となっている。,戦国時代
諸葛亮,しょかつりょう,181年~234年。中国三国時代の蜀漢の政治家、軍師。字は孔明。劉備に三顧の礼で迎えられ、蜀漢建国の立役者となった。「天下三分の計」を立案し、弱小勢力だった劉備を皇帝にまで押し上げた戦略家。八卦陣、木牛流馬などの軍事技術開発にも長け、「空城の計」をはじめとする心理戦の名手として知られる。劉備の死後は幼い劉禅を支え、蜀漢の宰相として内政に手腕を発揮。北伐を繰り返し魏に対抗したが、五丈原で病没。「鞠躬尽瘁、死而後已」(身を粉にして働き、死ぬまで止めない)の言葉通り、忠義と知謀を兼ね備えた理想的軍師として後世に語り継がれる。,三国時代
曹操,そうそう,155年~220年。中国後漢末期から三国時代の政治家、軍事家、文学者。字は孟徳。黄巾の乱の鎮圧で頭角を現し、董卓討伐戦に参加。官渡の戦いで袁紹を破り、中国北部を統一した。「治世の能臣、乱世の奸雄」と評されるように、混乱の時代に卓越した統率力を発揮。「唯才是挙」(才能のみを重視する人材登用)を実践し、多くの優秀な人材を集めた。軍事面では機動力を重視し、補給戦略に長けていた。文学者としても優れ、建安文学の担い手として多くの詩を残す。息子の曹丕が後漢を滅ぼし魏を建国する基盤を築いた、中国史上屈指の英傑。,後漢
韓信,かんしん,紀元前231年頃~196年。中国秦末~前漢初期の軍事家。劉邦(後の漢の高祖)に仕えて項羽との楚漢戦争で活躍し、漢王朝建国の立役者となった。「国士無双」「背水の陣」「四面楚歌」など、現代でも使われる故事成語の主人公。若い頃は貧しく「股くぐり」の屈辱を受けたが、蕭何の推薦で劉邦に重用される。井?の戦い、イク下の戦いなど数々の戦いで奇策を用いて勝利を収め、「兵仙」「戦神」と称された。用兵の天才として「韓信の用兵、多多益弁」(韓信が兵を用いれば、多ければ多いほど良い)と評価される。しかし、その能力を劉邦と呂后に警戒され、最後は謀反の疑いをかけられて処刑された悲劇の名将。,秦末
岳飛,がくひ,1103年~1142年。中国南宋の軍事家。金軍の侵攻から南宋を守った忠臣として知られる。農民出身から身を起こし、岳家軍を率いて金軍と戦い、連戦連勝を重ねた。「精忠報国」(精いっぱい忠義を尽くして国に報いる)を背中に刺青したとされ、母親の教えを生涯守り抜いた。?城の戦いでは金の精鋭部隊「鉄浮図」「拐子馬」を破り、金軍を震撼させた。しかし、宰相秦檜の和平政策と対立し、十二道金牌(十二回の緊急召還令)によって前線から呼び戻された。「莫須有」(あるかもしれない)という曖昧な謀反の罪で処刑されたが、後に名誉が回復され、忠義の象徴として崇敬される。岳廟が各地に建立され、現代中国でも愛国的軍人の模範として尊敬されている。武芸にも優れ、岳家拳の開祖ともされる。,宋
アレクサンドロス大王,あれくさんどろすだいおう,紀元前356年~323年。古代マケドニア王国の王。アリストテレスに師事し、20歳で王位を継承。13年間の東征でペルシア帝国を滅ぼし、インドまで達する大帝国を築いた。ガウガメラの戦い、イッソスの戦いなど数々の戦いで勝利を収め、敗北を知らない軍事的天才として知られる。常に軍の先頭に立って戦い、兵士たちから絶大な信頼を得た。ヘレニズム文化の創始者として、ギリシア文化とオリエント文化の融合を図った。「新しい世界の征服に向かいたいが、もう征服すべき世界が残っていない」と嘆いたとされる。32歳の若さでバビロンで没したが、短い生涯で古代世界最大の帝国を築き上げた史上最も偉大な征服者の一人。「山がマホメットのもとに来ないなら、マホメットが山のもとに行く」「不可能はない、あるのは意志の強さだけだ」などの名言で知られる。,古代マケドニア
ユリウス・カエサル,ゆりうす・かえさる,紀元前100年~44年。古代ローマの政治家、軍人、文学者。ガリア戦争でガリア(現在のフランス)を征服し、ローマの領土を大幅に拡大した。「来た、見た、勝った」(ベニ・ビディ・ビチ)の名言で知られる。ポンペイウス、クラッススとの第一回三頭政治を経て、ルビコン川を渡ってローマに進軍、内戦に勝利して独裁官となった。軍事面では機動力と工兵技術を重視し、アレシアの戦いでは二重の包囲陣を築いてベルキンゲトリクスを破った。『ガリア戦記』『内乱記』を著し、軍事史の貴重な記録を残す。暦の改革(ユリウス暦)、土地法の制定など内政でも業績を残したが、ブルータスらによって暗殺された。ローマ帝国の基礎を築いた偉大な指導者。,古代ローマ
ハンニバル,はんにばる,紀元前247年~183年頃。古代カルタゴの軍事指導者。第二次ポエニ戦争でローマと戦い、カンナエの戦いでローマ軍を壊滅させた戦術の天才。幼い頃に父ハミルカルから「ローマに復讐する」ことを誓わされ、生涯をローマとの戦いに捧げた。象を含む軍勢でアルプス山脈を越えてイタリア半島に侵入する大胆な作戦を実行。カンナエの戦いでは包囲殲滅戦術(ハンニバル戦術)を用いて8万のローマ軍を殲滅し、戦術史に不朽の名を刻んだ。15年間イタリア半島に留まってローマを脅かしたが、本国への援軍が断たれ、最終的にザマの戦いでスキピオに敗北。亡命先で自殺したが、「ローマの門前の敵」として最も恐れられた将軍の一人。,古代
ナポレオン・ボナパルト,なぽれおん・ぼなぱると,1769年~1821年。フランスの軍人、政治家、皇帝。フランス革命後の混乱期に頭角を現し、クーデターによって権力を掌握、後に皇帝となった。アウステルリッツの戦い、イエナ・アウエルシュタットの戦いなど数々の戦いで勝利を収め、ヨーロッパ大陸の大部分を支配下に置いた。「戦争は地形と時間の芸術である」「不可能という文字は愚者の辞書にのみ存在する」などの名言で知られる。軍事戦術では砲兵の集中運用、機動戦を得意とし、ナポレオン戦術として後世に影響を与えた。ナポレオン法典の制定など内政面でも手腕を発揮。ワーテルローの戦いで敗北し、セントヘレナ島で没したが、近世最大の軍事的天才として評価される。「愚人は運命を嘆き、凡人は運命に従い、賢人は運命を利用する」「私の死後、私の名は不滅となるだろう」などの言葉も残している。,近世
イエス・キリスト,いえす・きりすと,約2000年前にパレスチナで活動したキリスト教の創始者。神の愛と人類の救済を説き、十字架で殉教した後、復活したとされる。愛と赦しの教えは世界中に広がり、現在約25億人の信者を持つ宗教の礎となった。「汝の敵を愛せよ」「右の頬を打たれたら左の頬を差し出せ」などの教えで知られ、平和と愛の象徴として現代でも多くの人々に影響を与え続けている。その生涯と教えは新約聖書に記録され、西洋文明の基盤となった。,明
聖パウロ,せいぱうろ,1世紀のキリスト教の使徒。元々はキリスト教徒を迫害していたが、ダマスコ途上で劇的な回心を経験し、最も熱心な宣教師となった。地中海世界を巡回し、異邦人にキリスト教を広める活動を行った。新約聖書の多くの書簡を著し、キリスト教神学の基礎を築いた。「愛は忍耐強く、愛は情け深い」で始まる愛の讃美や「信仰と希望と愛、この三つは、いつまでも残る」などの言葉で知られる。殉教によって生涯を終えたが、その教えはキリスト教の発展に決定的な影響を与えた。,元
聖アウグスティヌス,せいあうぐすてぃぬす,4-5世紀の神学者・哲学者。北アフリカのヒッポの司教として活動し、キリスト教神学の発展に大きく貢献した。若い頃は放蕩生活を送っていたが、母モニカの祈りと聖書の言葉に導かれて回心した。その体験を記した「告白録」は自伝文学の傑作として知られる。「神の国」では理想的な共同体の在り方を論じ、中世ヨーロッパの政治思想に大きな影響を与えた。「汝が造られた我らは、汝のうちに憩うまでは心安らかならず」という言葉で、神への渇望を表現した。,中世
聖フランシスコ,せいふらんしすこ,12-13世紀イタリアの修道士。裕福な商人の家に生まれたが、神の呼びかけに応えて全財産を捨て、極貧の生活を送った。フランシスコ会を創設し、清貧・純潔・服従の誓いを立てた。自然を愛し、動物たちに説教したという逸話でも知られる。「平和を求める祈り」の作者とされ、「神よ、私をあなたの平和の道具としてください」の祈りは世界中で愛され続けている。十字架のキリストから直接語りかけられた体験や、キリストの聖痕を受けたとされる奇跡的な体験でも有名。環境保護の聖人としても現代に影響を与えている。,清
トマス・アクィナス,とます・あくぃなす,13世紀の神学者・哲学者。スコラ学の完成者として知られ、アリストテレス哲学とキリスト教神学の統合を図った。「神学大全」は中世最大の神学書として現在でも参照される。ドミニコ会の修道士として活動し、「天使博士」とも呼ばれた。神の存在証明や自然法理論など、理性と信仰の調和を追求した思想は、カトリック教会の公式教義の基盤となった。「恩寵は自然を破壊するのではなく、これを完成させる」という言葉で、理性と信仰の関係を表現した。その影響は神学にとどまらず、哲学、倫理学、政治学など広範囲に及んでいる。,明
マザー・テレサ,まざー・てれさ,20世紀の修道女。インドのコルカタで貧しい人々の救済に生涯を捧げた。「貧しい人の中でも最も貧しい人」への奉仕を使命とし、死を待つ人々の家や孤児院を運営した。1979年にノーベル平和賞を受賞。「愛の反対は憎しみではなく無関心です」「私たちは大きなことはできません。小さなことを大きな愛をもって行うだけです」などの言葉で知られる。死後、カトリック教会により列聖され、聖人となった。その生涯は愛と奉仕の象徴として世界中の人々に感動を与え続けている。現代における聖人の模範として多くの人に影響を与えている。,現代
マルティン・ルター,まるてぃん・るーたー,16世紀ドイツの宗教改革者。カトリック教会の腐敗を批判し、「95箇条の論題」を発表して宗教改革の火付け役となった。「信仰義認」の教理を主張し、善行ではなく信仰のみによって人は救われると説いた。聖書をドイツ語に翻訳し、一般民衆が聖書を読めるようにした功績も大きい。「ここに我立つ、他なしあたわず」という言葉で自らの信念を表明した。プロテスタントの礎を築き、キリスト教の多様性を生み出した。その思想は宗教にとどまらず、教育、政治、文化にも深い影響を与え、近世ヨーロッパの変革に大きな役割を果たした。,明
モーゼ,もーぜ,古代イスラエルの預言者・指導者。ユダヤ教の開祖とされる。エジプトで奴隷となっていたイスラエルの民を約束の地カナンに導いた出エジプトの指導者として知られる。シナイ山で神から十戒を受け、ユダヤ教の根本的な教えを確立した。「隣人を愛せよ」「汝殺すなかれ」などの倫理的教えは現在でも多くの宗教に影響を与えている。40年間荒野をさまよった後、約束の地を目前にして世を去った。その生涯は信仰、献身、指導力の模範とされ、ユダヤ教、キリスト教、イスラム教すべてで重要な預言者として尊敬されている。,古代イスラエル
釈迦,しゃか,紀元前5-6世紀頃、インドの王子として生まれた仏教の開祖。シッダールタ・ガウタマが本名で、29歳で出家し、35歳で菩提樹下で悟りを開いて仏陀(覚者)となった。四苦八苦の真理を説き、苦しみの原因とその解決法を示した。「中道」の思想で極端を避ける生き方を説き、八正道によって涅槃に至る道を示した。「すべての存在は苦である」「すべては無常である」などの教えで知られる。45年間にわたって教えを説き続け、80歳で入滅した。その教えは現在世界中に広がり、約5億人の信者を持つ宗教の基盤となっている。,元
空海,くうかい,平安時代初期の僧侶。真言宗の開祖として知られ、弘法大師の諡号で親しまれている。中国に渡って密教を学び、帰国後に高野山を開いて真言宗を確立した。「即身成仏」の教えで、この身のままで仏になることができると説いた。書道、詩文、彫刻など多方面にわたって才能を発揮し、「弘法筆を選ばず」の故事でも知られる。庶民の教育にも力を入れ、綜芸種智院を設立した。「生まれ生まれ生まれ生まれて生の始めに暗く、死に死に死に死んで死の終わりに冥し」という言葉で輪廻の深遠さを表現した。現在でも多くの人々に慕われている。,平安時代
道元,どうげん,鎌倉時代の僧侶。曹洞宗の開祖として知られる。中国に渡って臨済宗を学んだ後、帰国して只管打坐(ひたすらに座禅をする)の教えを説いた。「身心脱落」の境地を説き、座禅そのものが悟りであると教えた。主著「正法眼蔵」は日本仏教最高の哲学書とされる。「学道の人、まず須く貧なるべし」として清貧の重要性を説いた。永平寺を開創し、厳格な修行道場を確立した。「春は花夏ほととぎす秋は月冬雪さえて涼しかりけり」の歌で四季の美しさと無常を表現した。その教えは現代でも多くの人々に影響を与え続けている。,清
法然,ほうねん,平安時代末期から鎌倉時代の僧侶。浄土宗の開祖として知られる。比叡山で学んだ後、阿弥陀仏の本願を信じて念仏を唱えれば誰でも極楽浄土に往生できると説いた。「南無阿弥陀仏」の念仏を称えることで救われるという易行道を示し、学問や厳しい修行を積めない一般民衆にも仏教の門戸を開いた。「ただ念仏のみぞまことにておはします」として念仏の絶対性を説いた。その教えは親鸞や一遍などの弟子に受け継がれ、日本仏教の民衆化に大きな影響を与えた。慈悲深い人柄で知られ、多くの人々に慕われた。,平安時代
親鸞,しんらん,鎌倉時代の僧侶。浄土真宗の開祖として知られる。法然の弟子として念仏の教えを学んだ後、独自の教義を発展させた。「悪人正機」の思想で、煩悩深い凡夫こそが阿弥陀仏の救いの対象であると説いた。僧侶の妻帯を公にし、「非僧非俗」の立場を取った。「信心」の重要性を説き、阿弥陀仏への絶対的な信頼によって救われると教えた。主著「教行信証」で浄土真宗の教義を体系化した。「念仏者は無碍の一道なり」として自由な境地を表現した。その教えは現在でも多くの門徒に信仰され、日本最大の仏教宗派となっている。,鎌倉時代
日蓮,にちれん,鎌倉時代の僧侶。日蓮宗の開祖として知られる。法華経を最高の教えとし、「南無妙法蓮華経」の題目を唱えることで成仏できると説いた。他の宗派を激しく批判し、「立正安国論」で国家の安寧のために正しい仏法の確立を訴えた。度重なる法難に遭いながらも信念を貫き、佐渡に流罪になった際も教えを説き続けた。「我日本の柱とならん、我日本の眼目とならん、我日本の大船とならん」という誓いで知られる。熱烈な信仰と不屈の精神で多くの弟子を育て、現在でも日蓮系の各宗派に大きな影響を与えている。,鎌倉時代
最澄,さいちょう,平安時代初期の僧侶。天台宗の開祖として知られる。中国に渡って天台教学を学び、帰国後に比叡山を開いて天台宗を確立した。「法華経」を最高の教えとし、一乗思想を説いた。「一隅を照らす」という言葉で知られ、それぞれの立場で精一杯努力することの大切さを説いた。総合的な仏教教学を目指し、顕教と密教の融合を図った。比叡山は「日本仏教の母山」と呼ばれ、後に多くの高僧を輩出した。その教えは現在でも多くの人々に影響を与え、社会貢献活動の精神的基盤となっている。,平安時代
ムハンマド,むはんまど,6-7世紀のアラビア半島で活動したイスラム教の開祖。預言者として神(アッラー)の啓示を受け、コーラン(クルアーン)の教えを人々に伝えた。メッカで迫害を受けた後、メディナに移住(ヒジュラ)し、イスラム共同体を建設した。「アッラーの他に神はなし、ムハンマドは神の使徒なり」という信仰告白で知られる。正義、慈悲、平等を説き、部族社会に新しい秩序をもたらした。その教えは現在約18億人の信者を持つ世界第二の宗教となっている。商人出身で誠実な人柄から「信頼できる者」と呼ばれていた。イスラム教の発展とアラブ文明の興隆に決定的な役割を果たした。,明
ルーミー,るーみー,13世紀ペルシャの神秘主義詩人・神学者。メヴレヴィー教団の創始者として知られる。師シャムスとの出会いによって神秘体験に導かれ、愛と一体化の境地を詩に表現した。「マスナヴィー」など多くの詩作品は「ペルシャ語のコーラン」と呼ばれ、イスラム神秘主義の最高傑作とされる。「愛は橋である神と人との間の」という言葉で知られ、神への愛を人間の愛を通して表現した。旋回舞踊(セマー)を通じて神との一体化を図る修行法を確立した。その詩は現在でも世界中で愛読され、宗教の枠を超えて多くの人々に感動を与えている。,13世紀
イブン・アラビー,いぶん・あらびー,12-13世紀のイスラム神秘主義者・哲学者。「最大の師」と呼ばれ、イスラム神秘主義の理論的基盤を確立した。「存在の一性」の思想で、万物は神の顕現であると説いた。「完全人間」の概念を提示し、人間が神の属性を完全に体現できる存在であることを示した。主著「メッカの征服」「知恵の台座」は神秘主義の古典とされる。「あなたがたは神の鏡であり、神もあなたがたの鏡である」という言葉で神と人間の関係を表現した。その思想は後のイスラム哲学に大きな影響を与え、現在でも神秘主義研究の重要な対象となっている。,13世紀
織田信長,おだのぶなが,1534年~1582年。戦国時代の武将、戦国大名。尾張国の小大名から出発し、桶狭間の戦いで今川義元を破って頭角を現した。「天下布武」を掲げ、革新的な戦法と政策で戦国時代の常識を覆した。長篠の戦いでは鉄砲を大量投入して武田軍を破り、石山本願寺との戦いでは鉄甲船を建造するなど新技術を積極的に導入。楽市楽座、関所の廃止など経済政策でも手腕を発揮した。「是非に及ばず」の言葉通り、現実主義的で合理的思考の持ち主。比叡山焼き討ち、一向一揆の弾圧など苛烈な面もあったが、旧秩序を破壊して新しい時代を切り開いた革命児。本能寺の変で明智光秀に討たれたが、その後の統一事業は豊臣秀吉、徳川家康に引き継がれた。,戦国時代
