name,reading,biography,period
セルゲイ・ブリン,せるげい・ぶりん,ロシア生まれのアメリカのコンピューター科学者・起業家。ラリー・ペイジとともにGoogleを共同創設した。データマイニングとウェブ解析の専門家として、検索技術の革新に貢献した。スタンフォード大学でコンピューターサイエンスの博士号を取得し、ウェブ検索の研究を行った。BackRubプロジェクトからGoogleの検索エンジンを発展させ、世界最大の検索サービスを構築した。ユーザーの検索行動を分析し、広告配信の効果を最大化するAdWordsシステムを開発した。Google XやAlphabet社で、自動運転車、Google Glass、人工知能などの先端技術開発を推進している。パーキンソン病の研究支援にも取り組み、科学研究への慈善活動を展開している。宇宙開発にも関心を持ち、宇宙旅行の民間企業への投資を行っている。「技術は世界をより良い場所にできる」という信念のもと、革新的な技術開発を続けている。現代のインターネット文化と情報社会を形作った偉大な技術者。,現代
マーク・ザッカーバーグ,まーく・ざっかーばーぐ,アメリカの起業家・プログラマー。Facebookの創設者として、ソーシャルネットワークの時代を開いた。ハーバード大学在学中に寮の一室でFacebookを立ち上げ、世界最大のSNSに成長させた。「世界をより開かれた、つながりのある場所にする」というミッションを掲げている。月間アクティブユーザー数約30億人のプラットフォームを構築し、人々のコミュニケーション方法を変革した。Instagram、WhatsAppの買収により、ソーシャルメディア領域を拡大した。VR技術の発展に投資し、メタバース(仮想世界)の実現を目指している。人工知能の研究開発にも取り組み、AIの社会実装を推進している。チャン・ザッカーバーグ・イニシアチブを設立し、教育、科学、正義の分野で慈善活動を展開している。プログラミング教育の普及に努め、次世代の技術者育成に貢献している。現代のソーシャルメディア文化と人々のつながり方を根本的に変えた影響力のある起業家。,現代
アルフレッド・ノーベル,あるふれっど・のーべる,スウェーデンの化学者・発明家・実業家。ダイナマイトの発明により、建設工事と鉱業を革新した。ニトログリセリンの安全な取り扱い方法を開発し、爆薬の実用化に成功した。生涯で355件の特許を取得し、多くの発明品を世に送り出した。国際的な軍需企業を経営し、巨万の富を築いた。「死の商人」と呼ばれることを憂い、遺言により財産をノーベル賞の創設に寄付した。物理学、化学、生理学・医学、文学、平和の5分野で優れた業績を讃える賞を設立した。科学技術の発展と世界平和への貢献を目指し、人類の福祉向上を願った。多言語に堪能で、文学作品の創作にも取り組んだ。孤独な性格で生涯独身を貫き、研究と事業に専念した。彼の遺産により設立されたノーベル賞は、現在でも世界最高峰の栄誉とされている。科学の発展と平和の実現を願った偉大な発明家・慈善家。,明
グリエルモ・マルコーニ,ぐりえるも・まるこーに,イタリアの発明家・電気技術者。無線通信の実用化により、通信技術を革新した。1895年に無線電信の実験に成功し、電波による遠距離通信を実現した。1901年に大西洋を横断する無線通信に成功し、世界的な通信網の可能性を示した。1909年にノーベル物理学賞を受賞し、無線通信技術の発展に貢献した。マルコーニ会社を設立し、無線通信事業を商業化した。タイタニック号の遭難事故では、無線通信により多くの人命を救った。海上通信の安全性を向上させ、船舶の航行に革命をもたらした。短波通信の研究により、長距離通信の効率化を実現した。第一次世界大戦中は軍事通信の発展に貢献した。無線技術の発展により、後のラジオ、テレビ、携帯電話の基盤を築いた。情報伝達の即時性を実現し、現代のグローバル社会の基礎を作った。「無線通信の父」として、通信技術の発展に永続的な影響を与えた偉大な発明家。,明
ルドルフ・ディーゼル,るどるふ・でぃーぜる,ドイツの機械技術者・発明家。ディーゼルエンジンの発明により、内燃機関技術を革新した。1893年に圧縮着火式エンジンを開発し、燃費効率の高い動力源を実現した。植物油を燃料とする実験を行い、バイオ燃料の先駆けとなった。蒸気機関よりも効率的で軽量なエンジンを開発し、交通機関を変革した。船舶、鉄道、自動車、発電機など幅広い分野で活用される技術を確立した。熱効率の向上により、燃料消費量を大幅に削減した。重工業の発展に大きく貢献し、現代の産業基盤を支えている。社会主義的な思想を持ち、技術による社会改革を目指した。謎の死を遂げたが、その技術は後世に受け継がれた。現在でも大型車両、船舶、発電所などでディーゼルエンジンが使用されている。環境問題の観点から見直しが進んでいるが、効率性の高さは評価されている。動力技術の発展に革命をもたらした偉大な発明家。,明
ウィリアム・ハーベイ,うぃりあむ・はーべい,イギリスの医師・生理学者。血液循環の発見により、現代生理学の基礎を築いた。心臓がポンプとして血液を全身に送り出し、血液が体内を循環することを証明した。動物の解剖実験により、血液の流れを詳細に観察した。ガレノスの血液理論を覆し、実証的な医学研究の重要性を示した。『心臓と血液の運動について』を著し、血液循環理論を体系化した。定量的な測定により、心臓から送り出される血液量を計算した。実験に基づく科学的方法論を医学に導入し、近代医学の発展に寄与した。王室の侍医として活動し、医学の権威として認められた。比較解剖学の手法により、人間と動物の生理機能を比較研究した。彼の発見は輸血、心臓手術、循環器疾患の治療の基礎となった。血液循環の理解により、現代の心血管医学の発展を可能にした。実験医学の先駆者として、医学研究の方法論を確立した偉大な医学者。,明
ルイス・カロル,るいす・かろる,イギリスの数学者・写真家・児童文学作家。『不思議の国のアリス』の作者として知られる。本名はチャールズ・ドジソンで、オックスフォード大学で数学を講義した。数学的論理学の研究を行い、記号論理学の発展に貢献した。写真技術の初期の実践者として、多くの肖像写真を残した。児童文学に数学的な思考とユーモアを融合させた独特の世界観を創造した。論理パズルや数学的遊びを多数考案し、娯楽数学の発展に貢献した。『鏡の国のアリス』では、チェスの動きを物語の構造に組み込んだ。言葉遊びと論理的思考を組み合わせた創作手法を確立した。シュルレアリスムの先駆けとなる幻想的な作品を創作した。教育における創造性と論理性の重要性を示した。数学と文学を結び付けた学際的な活動により、教育と文化の発展に貢献した。科学的思考と芸術的創造性を統合した先駆的な知識人。,
ジークムント・フロイト,じーくむんと・ふろいと,オーストリアの神経学者・精神科医。精神分析学の創始者として、現代心理学の基礎を築いた。無意識の概念を提唱し、人間の心理を意識、前意識、無意識に分類した。エディプス・コンプレックスや夢の分析により、人間の深層心理を解明した。『夢の解釈』で夢を無意識の願望の表れとして分析した。精神的な病気を心理的要因から説明し、治療法を開発した。自由連想法や転移の概念により、精神分析の技法を確立した。人間の性的衝動を心理発達の原動力として重視した。文学、芸術、宗教などの文化現象を心理学的に分析した。精神医学の発展に革命をもたらし、現代の心理療法の基盤を作った。彼の理論は心理学のみならず、文学、哲学、社会学にも大きな影響を与えた。人間の心の複雑さを科学的に探求し、現代の精神保健医療の発展に貢献した。20世紀の思想に最も大きな影響を与えた学者の一人。,明
カール・ユング,かーる・ゆんぐ,スイスの精神科医・心理学者。分析心理学の創始者として、深層心理学の発展に貢献した。集合無意識の概念を提唱し、人類共通の心的構造を仮定した。元型理論により、神話や宗教の心理学的基盤を解明した。内向性と外向性の性格タイプを提案し、現代のパーソナリティ心理学の基礎を築いた。個性化過程の概念により、人間の心理的成長を理論化した。夢の分析において、フロイトとは異なる解釈法を確立した。東洋思想と西洋心理学を統合し、文化横断的な心理学理論を構築した。錬金術の象徴的研究により、人間の心理的変容を探求した。シンクロニシティ(共時性)の概念を提唱し、偶然の一致の意味を考察した。アクティブ・イマジネーション(能動的想像)の技法を開発した。現代の心理療法、カウンセリング、心理検査の発展に大きく貢献した。人間の心の深層を探求し、現代の心理学と精神医療の発展を促進した偉大な心理学者。,元
カール・フリードリヒ・ガウス,かーる・ふりーどりひ・がうす,ドイツの数学者・物理学者・天文学者。「数学の王」と呼ばれ、数学のあらゆる分野で業績を残した。整数論、代数学、解析学、幾何学、確率論など幅広い分野で革新的な研究を行った。最小二乗法を発明し、測定誤差の処理方法を確立した。正十七角形の作図可能性を証明し、古代ギリシャ以来の幾何学問題を解決した。小惑星ケレスの軌道計算により、天体力学の発展に貢献した。電磁気学の研究を行い、磁力の単位「ガウス」に名前を残した。素数分布の研究により、素数定理の基礎を築いた。複素数の幾何学的解釈により、複素解析の発展を促進した。非ユークリッド幾何学の研究も行ったが、当時は発表しなかった。測地学、統計学、物理学の分野でも重要な貢献をした。「神は数論を創造し、他はすべて人間の創造物である」という言葉で知られる。数学の多くの分野で基礎を築いた偉大な数学者。,古代
ベルンハルト・リーマン,べるんはると・りーまん,ドイツの数学者。リーマン幾何学の創始者として、現代数学の基礎を築いた。リーマン面の理論により、複素解析を大幅に発展させた。リーマン予想を提唱し、現在でも数学の最重要未解決問題の一つとなっている。曲率の概念を導入し、曲がった空間の幾何学を確立した。リーマン積分の定義により、積分理論を厳密化した。楕円関数論の研究により、複素関数論の発展に貢献した。物理学への応用も視野に入れ、数学と物理学の橋渡しをした。アインシュタインの一般相対性理論の数学的基盤を提供した。短い生涯(39歳で死去)にもかかわらず、数学の発展に計り知れない影響を与えた。ガウスの弟子として、ドイツ数学の黄金時代を築いた。現代の微分幾何学、位相幾何学、数論の発展に重要な貢献をした。リーマン幾何学は現在でも理論物理学で重要な役割を果たしている。数学の抽象化と一般化を推進した偉大な数学者。,現代
フィボナッチ,ふぃぼなっち,"イタリアの数学者。本名はレオナルド・ダ・ピサ。フィボナッチ数列の発見により、数学史に名を残した。『算盤の書』により、アラビア数字とインド・アラビア数学をヨーロッパに紹介した。0から9までの数字と十進法の普及に大きく貢献した。ウサギの繁殖問題を通じて、1, 1, 2, 3, 5, 8, 13...という数列を発見した。この数列は自然界の多くの現象に現れることが後に判明した。黄金比との関連性により、芸術と数学の結び付きを示した。商業数学の発展に貢献し、実用的な計算法を確立した。中世ヨーロッパの数学教育の改革に大きな影響を与えた。アラビア数学の知識をヨーロッパに移転し、数学の発展を促進した。フィボナッチ数列は現在でも数学、コンピューターサイエンス、自然科学で重要な役割を果たしている。彼の業績により、ヨーロッパの数学は大きく発展し、ルネサンス時代の科学革命の基盤を築いた。数学の実用性と美しさを示した偉大な数学者。",明
ティコ・ブラーエ,てぃこ・ぶらーえ,デンマークの天文学者。精密な天体観測により、近代天文学の基礎を築いた。ウラニボルク天文台を建設し、当時最も正確な天体観測を実施した。1572年に出現した新星を観測し、天体が不変であるという古代の概念を覆した。火星の軌道を20年間にわたり観測し、ケプラーの法則発見の基礎データを提供した。ティコ・ブラーエ体系という地球中心と太陽中心の中間的な宇宙模型を提唱した。望遠鏡発明以前の時代に、肉眼観測として最高精度の天体観測を実現した。彗星の観測により、天体が地球大気圏外に存在することを証明した。天文学の観測技術と測定器具の改良に貢献した。弟子のケプラーに正確な観測データを遺し、惑星運動の法則発見を可能にした。貴族でありながら科学研究に専念し、天文学の発展に私財を投じた。現代の天文学における精密観測の重要性を示した。観測天文学の発展に革命をもたらした偉大な天文学者。,古代
ジョージ・バイロン,じょーじ・ばいろん,イギリスの詩人(1788-1824)。ロマン主義の代表的詩人として、情熱的な愛と自由を歌った。「ドン・ジュアン」「チャイルド・ハロルドの遍歴」などの作品で、愛の歓びと痛み、人間関係の複雑さを描いた。「愛は人生の詩であり、美は人生の音楽である」「真の愛は永遠に続く」など、愛の永遠性について語った名言を残している。自由奔放な生活と多くの恋愛経験を持ち、その情熱的な人生が作品に反映されている。ギリシャ独立戦争に参加し、理想のために戦った。,
パブロ・ネルーダ,ぱぶろ・ねるーだ,チリの詩人・外交官(1904-1973)。ノーベル文学賞受賞者。「20の愛の詩と1つの絶望の歌」「100の愛のソネット」などで愛を歌い続けた。「愛は短い言葉だが、それを言うには一生かかる」「愛することを学ぶのに遅すぎることはない」など、愛の深さと普遍性を表現した名言を多数残している。政治的な詩人としても知られ、人間愛と社会正義を結びつけた作品を多く発表した。彼の詩は世界中で愛され、愛の詩人として多くの人々に影響を与え続けている。,
ルミ,るみ,ペルシャの詩人・神秘主義者(1207-1273)。イスラム神秘主義(スーフィズム)の代表的詩人として、神への愛と人間愛を歌った。「愛は人生の橋である」「愛はすべての言語を話し、すべての沈黙を理解する」など、愛の普遍性と深さを表現した名言を多数残している。彼の詩は宗教や文化を超えて愛され、現代でも多くの人々に読まれている。師シャムス・ウッディーン・タブリーズィーとの深い友情と別れが、彼の詩作の大きな原動力となった。愛による魂の成長と神との一体化というテーマを生涯追求した。,現代
エミリー・ディキンソン,えみりー・でぃきんそん,アメリカの詩人(1830-1886)。隠遁生活を送りながら、愛と死、自然について深い洞察を示した詩を書いた。「愛は前線であり、人生は後方である」「愛は不在によってより強くなる」など、愛の本質を鋭く捉えた名言を残している。生前はほとんど作品を発表せず、死後に約1800篇の詩が発見された。独特の短詩形式で、愛の微細な感情や人間関係の繊細さを表現し、アメリカ文学史上最も重要な詩人の一人とされている。孤独の中から生まれた深い人間洞察が、現代の読者にも強い共感を呼んでいる。,現代
カリール・ジブラーン,かりーる・じぶらーん,レバノン系アメリカ人の詩人・作家・画家(1883-1931)。「預言者」の著者として世界的に知られる。「愛は所有ではなく、与えることである」「愛において、二人は一つになっても、一人一人でいなさい」など、愛の理想的な姿について深い洞察を示した名言を多数残している。東洋の神秘主義と西洋の思想を融合させた独特の世界観で、愛と人間関係の本質を詩的に表現した。彼の作品は世界中で愛され、特に結婚式でよく引用される。人間の魂の成長と愛による変容というテーマを生涯追求した。,
ジョン・キーツ,じょん・きーつ,イギリスの詩人(1795-1821)。ロマン主義の代表的詩人として、美と愛を歌った。「愛は永遠の生命である」「美は真理であり、真理は美である」など、愛と美の関係について深い洞察を示した。わずか25歳で夭折したが、その短い生涯の中で不朽の名作を残した。婚約者ファニー・ブローンへの深い愛が、彼の詩作の大きな原動力となった。「エンディミオン」「ラミア」などの作品で、愛の歓びと苦悩、美への憧憬を歌い、後世の詩人たちに大きな影響を与えた。,
プラトン,ぷらとん,古代ギリシャの哲学者(紀元前427-347)。「饗宴」において愛の本質について深く論じた。「愛は魂の半分を探し求める行為である」「真の愛は美しい魂に向かう」など、愛について哲学的な洞察を示した名言を残している。プラトニックラブの語源ともなった精神的な愛の概念を提唱し、肉体的な愛から精神的な愛、そして真理への愛へと段階的に昇華していく愛の階梯を示した。師ソクラテスとの関係も深い友愛として知られ、人間関係における知的な結びつきの重要性を強調した。,古代
アリストテレス,ありすとてれす,古代ギリシャの哲学者(紀元前384-322)。「ニコマコス倫理学」において友愛について詳しく論じた。友愛を「有用性に基づく友愛」「快楽に基づく友愛」「徳に基づく友愛」の三つに分類し、最も高い友愛は徳に基づくものだと述べた。「友は他の自分である」「友愛なしには誰も生きようとは思わない」など、友情の重要性を強調した名言を残している。また、愛と友情の違いについても考察し、人間関係における理性と感情の役割を分析した。彼の友愛論は現代の人間関係論にも大きな影響を与えている。,古代
セネカ,せねか,古代ローマの哲学者・政治家(紀元前4-65)。ストア派の哲学者として、愛と友情について深く考察した。「愛は魂の病気ではなく、魂の健康である」「真の友情は時間によって試される」など、愛と友情の本質について洞察に富んだ名言を残している。皇帝ネロの師として政治にも関わったが、最終的に自殺を命じられた。困難な状況においても人間愛を貫き、他者への思いやりと自己制御の重要性を説いた。彼の書簡は友人への深い愛情に満ちており、友情の美しさを示している。,古代ローマ
マルクス・アウレリウス,まるくす・あうれりうす,ローマ皇帝・哲学者(121-180)。「自省録」において人間愛について深く考察した。「人間は社会的な動物であり、互いに助け合うために生まれてきた」「愛は行動であり、感情だけではない」など、愛の実践的な側面について語った名言を残している。皇帝という権力の頂点にありながら、ストア派の哲学を実践し、すべての人間に対する愛と理解を示した。彼の統治は「哲人皇帝」として理想的なものとされ、権力と愛の両立を実現した稀有な例として評価されている。,
アウグスティヌス,あうぐすてぃぬす,キリスト教の教父・哲学者(354-430)。「愛によって歩みなさい、そうすれば害を与えることはない」「愛は魂の重さである」など、愛の力と重要性について深い洞察を示した名言を残している。「告白」において自身の回心体験を描き、神への愛と人間愛の関係について論じた。放蕩な青年時代を経て回心し、その体験が彼の愛についての理解を深めた。愛は単なる感情ではなく、意志による選択であり、他者の善を願う行為であると説いた。彼の愛の思想はキリスト教思想に大きな影響を与えた。,
ブレーズ・パスカル,ぶれーず・ぱすかる,フランスの哲学者・数学者・物理学者(1623-1662)。「パンセ」において愛と人間関係について深く考察した。「心には理性では理解できない理屈がある」「愛は理性を超える」など、愛の非合理的な側面について洞察に富んだ名言を残している。科学者として理性的思考を重んじながらも、人間の感情と愛の重要性を認識していた。神への愛と人間愛の関係について深く考察し、愛こそが人間の本質であると説いた。彼の「賭け」の理論は、信仰と愛の関係について独特の視点を提供している。,
ジャン=ジャック・ルソー,じゃん・じゃっく・るそー,フランスの哲学者・作家(1712-1778)。「エミール」「新エロイーズ」などの作品で愛と教育について論じた。「愛は教育の最も重要な要素である」「心の声に従いなさい」など、愛の自然性と重要性について語った名言を残している。自然状態における人間の善良さを主張し、愛もまた自然な感情であるとした。恋愛小説「新エロイーズ」では、情熱的な愛と理性的な愛の対立を描き、18世紀の読者に大きな影響を与えた。教育における愛の重要性を強調し、現代の教育思想にも影響を与えている。,現代
イマヌエル・カント,いまぬえる・かんと,ドイツの哲学者(1724-1804)。「実践理性批判」において道徳と愛の関係について論じた。「愛は義務ではなく、しかし義務は愛によって美しくなる」「他人を手段としてではなく、目的として扱いなさい」など、愛の道徳的側面について深い洞察を示した名言を残している。純粋理性批判により理性の限界を明らかにし、実践理性の領域で愛と道徳の関係を考察した。愛は感情であり命令できないが、愛の行為は道徳的義務として実践できるとした。彼の人格主義は現代の人権思想の基礎となっている。,明
